{
  "protocol": "XLMP",
  "version": 1,
  "message_id": "xlmessage:blake3:76948f144e89bbe4c4449b4e782d37aae25dbe8cd9d5135ae2a86a9f49cb68c5",
  "correlation_id": null,
  "sender": "did:key:checker-node-example",
  "sent_at": "2026-09-03T12:00:00Z",
  "message": {
    "type": "XLMP_NODE_ADVERTISE",
    "payload": {
      "advertisement": {
        "advertisement_id": "xladv:blake3:04719a7cb5a40a37d3ca1441dcc922fc26ef1b3a3970560e5c6e7d7a29660a5e",
        "node_id": "xlnode:blake3:aaaaaaaaaaaaaaaaaaaaaaaaaaaaaaaaaaaaaaaaaaaaaaaaaaaaaaaaaaaaaaaa",
        "operator_id": "xlop:blake3:e7e8b7222bc5e3d3781ab251f5cf130fd879d9478162b65d012007deeb7c2e3b",
        "operator_cluster_id": "xloperator:blake3:dddddddddddddddddddddddddddddddddddddddddddddddddddddddddddddddd",
        "user_credential_id": "xlusercred:blake3:b967ca8a33c289ae8db77ebacf2634962353fe49edea1fe9e17b1e67aa4a2ed9",
        "operator_credential_id": "xloperatorcred:blake3:33a8631e123761e53abb02af549f534eb57fbb948013d3fd437d8e425c38dc09",
        "node_credential_id": "xlnodecred:blake3:c94fe9ad1621454c06fc70f3779479fc04ece86ec3bcf9d0d27f8996e1f2b95e",
        "credential_chain_root": "blake3:9ea5ea987a301805a35cc6d203113e6effa145ffee12beced8f715bf23eb3dd9",
        "jurisdiction_class": "privacy-preserving-verified",
        "sequence": 1,
        "roles": ["official_kernel_checker"],
        "endpoints": [
          {
            "transport": "https",
            "uri": "https://checker.example/xlmp/v1/messages",
            "authentication_profile": "did-key-v1"
          }
        ],
        "capabilities": [
          {
            "service": "official_verification",
            "implementation_id": "lean4checker@4.33.1",
            "checker_families": ["lean_kernel"],
            "supported_theory_ids": [
              "xlt:blake3:1111111111111111111111111111111111111111111111111111111111111111"
            ],
            "domains": ["formal-mathematics"],
            "hardware": {
              "class": "cpu",
              "architecture": "arm64",
              "accelerator": null,
              "memory_mib": 8192,
              "trusted_execution_attestation": null
            },
            "maximum_parallel_jobs": 4,
            "capacity_units": 10000,
            "available_units": 8000,
            "p50_latency_ms": 500,
            "p95_latency_ms": 1000,
            "price": {
              "pricing_model": "metered",
              "unit_name": "checker-ms",
              "quantity_scale": 100,
              "amount": { "units": 50, "asset": "USDC", "decimals": 6 }
            }
          }
        ],
        "reputation_snapshot_id": "xlreputation:blake3:cccccccccccccccccccccccccccccccccccccccccccccccccccccccccccccccc",
        "bond_id": "xlbond:blake3:dddddddddddddddddddddddddddddddddddddddddddddddddddddddddddddddd",
        "terms_root": "blake3:node-service-terms-v1",
        "valid_from": "2026-09-03T00:00:00Z",
        "valid_until": "2026-09-04T00:00:00Z",
        "supersedes": null,
        "delegation_signature": "example-advertisement-delegation-signature",
        "signature": "example-node-signature"
      }
    }
  },
  "signature": "example-xlmp-node-advertisement-signature"
}
